{
  "$schema": "https://json-schema.org/draft/2020-12/schema",
  "$id": "https://github.com/trading-optimizer-lab-org/aurora/schemas/catalog_campaign_definition_manifest_v1.schema.json",
  "title": "AURORA catalog campaign definition manifest v1",
  "type": "object",
  "additionalProperties": false,
  "required": [
    "schema_version",
    "closure_algorithm",
    "campaign_key",
    "registry_entry_sha256",
    "entries"
  ],
  "properties": {
    "schema_version": {
      "const": "1"
    },
    "closure_algorithm": {
      "const": "aurora-catalog-transitive-closure-v1"
    },
    "campaign_key": {
      "type": "string",
      "pattern": "^[a-z0-9]+(?:-[a-z0-9]+)*-v[0-9]+$"
    },
    "registry_entry_sha256": {
      "type": "string",
      "pattern": "^[0-9a-f]{64}$"
    },
    "entries": {
      "type": "array",
      "minItems": 1,
      "items": {
        "type": "object",
        "additionalProperties": false,
        "required": ["path", "role", "sha256", "size_bytes"],
        "properties": {
          "path": {
            "type": "string",
            "minLength": 1,
            "pattern": "^(?!/)(?!.*\\\\)(?!.*(?:^|/)\\.{1,2}(?:/|$))(?!.*//)[^\\u0000-\\u001f:]+$"
          },
          "role": {
            "enum": [
              "contract",
              "schema",
              "configuration",
              "science_code",
              "workflow",
              "data_identity"
            ]
          },
          "sha256": {
            "type": "string",
            "pattern": "^[0-9a-f]{64}$"
          },
          "size_bytes": {
            "type": "integer",
            "minimum": 0
          }
        }
      }
    }
  }
}
