{"campaign_key":"sp500-optimized-catalog-v1","closure_algorithm":"aurora-catalog-transitive-closure-v1","entries":[{"path":".github/actions/aurora-merge-level/action.yml","role":"workflow","sha256":"2834213692e4ba320264090b1a21945ba939d1d78afeca5ab4870af400f82935","size_bytes":14647},{"path":".github/actions/aurora-recovery-plan/action.yml","role":"workflow","sha256":"b8386866db911627efbfb6bab8372f7172fa45b8323a4b3c91e07daa8fe471f3","size_bytes":37455},{"path":".github/actions/aurora-runtime-setup/action.yml","role":"workflow","sha256":"f56dcbac8fb16e7865edfa65cd2c05f3829acf68685a21380b9b29b35c7039de","size_bytes":9154},{"path":".github/workflows/catalog-component-worker.yml","role":"workflow","sha256":"58d4deb2923fa2b451bea9168d900beb95015d14cdc1e355dd275b145210da39","size_bytes":17419},{"path":".github/workflows/catalog-optimized-run.yml","role":"workflow","sha256":"139317851395b331ca812d8b98791338cc99e3264308f17fc101c96073d440ad","size_bytes":176702},{"path":".github/workflows/catalog-optimized-worker.yml","role":"workflow","sha256":"9adff5f7145d110f1b2e436433f7cc7dfb8c33b2e229e7abdf3aefaf3c571613","size_bytes":63364},{"path":".github/workflows/catalog-recovery-wave.yml","role":"workflow","sha256":"30f82b7ecf2cb38638205c8d4a796d16fe358430486200b883b49d3f2bb2b946","size_bytes":13663},{"path":"config/catalog_campaign_registry_v1.json","role":"configuration","sha256":"4674902065f2bde75379b77e1f8ffbae96c213cd7ed18086a47489c0cc805c2b","size_bytes":2596},{"path":"config/catalog_checkpoint_recovery_archives_v1.json","role":"configuration","sha256":"c8092190347cfe90b465352244414135ca7ab3675df29d68490fa98c2de2d824","size_bytes":1632},{"path":"config/catalog_checkpoint_recovery_profiles_v1.json","role":"configuration","sha256":"345b0c9d95d33cb050875cc760cc3958a5f8f37dcdf13581148d4ec2f1ab9c1d","size_bytes":70780},{"path":"config/catalog_controller_actors_v1.json","role":"configuration","sha256":"3c66acd825bd048152870512f08d37bb3e8e06fc735cd53de9701f595ee03753","size_bytes":545},{"path":"config/catalog_fast_canary_recovery_policy_v1.json","role":"configuration","sha256":"5b118715d45ffdf8432d62e8c42ca4f57e2412351a429238228541baafc5b09d","size_bytes":500},{"path":"config/catalog_reduction_recovery_profiles_v1.json","role":"configuration","sha256":"62b90d1af0ea29d0d0f6d2c3f002ff5b0edb03ad21295eec477eab5c4d055981","size_bytes":9799},{"path":"config/catalog_requester_public_key_v1.pem","role":"configuration","sha256":"ce95fbfd3c02cb280a2e5a2a913d2e71a3e2a3ca7e8c2eee94e1c4241edfd9f0","size_bytes":451},{"path":"config/sp500_catalog_admission_evidence_current_v1.json","role":"configuration","sha256":"a8e6cabfc1865243afe562c14698fd69021ef874601e7b4818f27a88b988e04c","size_bytes":327},{"path":"config/sp500_catalog_optimization_policy_v1.json","role":"configuration","sha256":"5a1e4ecb3495d4d54a11e2fd870fe9533825e5742cc00700103e62eabb7a4a89","size_bytes":3174},{"path":"config/sp500_megarun_dehb_campaign_v1.json","role":"contract","sha256":"4f7b51168a4a50b0365b6e04e767b20543ff6fd74417d800f05356629521fd3b","size_bytes":6261},{"path":"config/sp500_megarun_feature_contract_240.json","role":"contract","sha256":"58dd6dba2857223c2040ef383b7ec0513b957675f4ba104ffc408ab5f47ad62c","size_bytes":168234},{"path":"config/sp500_megarun_free_data_120.json","role":"data_identity","sha256":"ebfa47e7f040f13d4c27a2500d6db61a06c5a059004e9d96e874db028e88ac14","size_bytes":34795},{"path":"config/sp500_megarun_free_data_240.json","role":"data_identity","sha256":"9b2a971c1d1ad0374ad63e03e03c91127bf634e0ed822195c06180140acfa2c8","size_bytes":40069},{"path":"config/sp500_megarun_selected_dehb_13.json","role":"configuration","sha256":"cca71084795e9997978f4ad82578a37b3fdbd82bf6f486ea62c202405a7b0fb8","size_bytes":2841},{"path":"config/sp500_megarun_strategy_catalog_v1/README.md","role":"data_identity","sha256":"bca3f4f8b33b0a23df6d9a141ef5e9689832bff7b6869f8984702aea06e5a9f4","size_bytes":732},{"path":"config/sp500_megarun_strategy_catalog_v1/catalog.csv","role":"data_identity","sha256":"5d24ca8f16938e3a5951b6d5728857028aa90c2a3af64bb4c5fc80c2303e0cbd","size_bytes":46560917},{"path":"config/sp500_megarun_strategy_catalog_v1/catalog.jsonl","role":"data_identity","sha256":"92551da48026e355745628515a1538bef97907fd0829c929f07bd85ba13b0abb","size_bytes":54746885},{"path":"config/sp500_megarun_strategy_catalog_v1/coverage.json","role":"data_identity","sha256":"7c2c1346933c45621fcd60b5b0554a34e358279d8e1356313c4f0c5adfe3ad4f","size_bytes":574250},{"path":"config/sp500_megarun_strategy_catalog_v1/manifest.json","role":"data_identity","sha256":"53739fc5a3ef9d9d7ed1ffe51d835fa1359bfcf94316d55551804aa333a01cc1","size_bytes":880},{"path":"infra/github_performance/campaign.py","role":"science_code","sha256":"05332d983b4e20d53338175a48cad4015b73ef28235782c316da827bac62c4d7","size_bytes":25849},{"path":"infra/github_performance/checkpoint.py","role":"science_code","sha256":"43524074b286cd3c81702a9608701c20c520e3448f8f115a66034b71a5b11b18","size_bytes":5716},{"path":"infra/github_performance/contracts.py","role":"science_code","sha256":"98c6c6be9e02369c6b032cd6741da91b3e0c9ebfba97ff64937c185ed6ebbe95","size_bytes":21927},{"path":"infra/github_performance/merge_planner.py","role":"science_code","sha256":"3e296a56ebe74f08adf81141475c8f41ffd6e21f000e6cb273a7ada5e50e0ed6","size_bytes":29451},{"path":"infra/github_performance/recovery.py","role":"science_code","sha256":"74cafa2fcf5e5d9be29e88eaf62add76fc85095bf99334ea62ac2e9c5e6dcb12","size_bytes":53788},{"path":"infra/github_performance/shard_planner.py","role":"science_code","sha256":"181bb6e3dc596d752d82ad6876ef1b830d35c56f3a1367ffab466c00e379aa43","size_bytes":15505},{"path":"infra/sp500_long_short_daily/contracts.py","role":"science_code","sha256":"8c2f41a1826e73b3a4fe04be490cd5b491969e63273b0ca9bbfc1b522562958d","size_bytes":11358},{"path":"infra/sp500_long_short_daily/ledger.py","role":"science_code","sha256":"cd8d625cb7c00ab7fa48e81be368c49e46ca74d7e5e977a322168c28d5ed4505","size_bytes":5920},{"path":"infra/sp500_megarun/advanced_feature_engine.py","role":"science_code","sha256":"d884c8da1864f45a52fe72a8aa5f3b93d86ce49abae4f12a831fb7a0a3fe616d","size_bytes":43587},{"path":"infra/sp500_megarun/advanced_feature_smoke.py","role":"science_code","sha256":"7e6a4eaa2d6010feafdc061fcfa73bfc6e2ab75def27e8fc9096fb1f711b7ec7","size_bytes":6242},{"path":"infra/sp500_megarun/catalog_actions_audit.py","role":"science_code","sha256":"5916edbc3b926652d8b1e0bad0e54f40f26e9c1d3d73e2d94d4b43c54bf9d3eb","size_bytes":10539},{"path":"infra/sp500_megarun/catalog_admission.py","role":"science_code","sha256":"c48ec85b5c948694f505eedfb8f4a0caa811575fc9f287fd786c78d76062383c","size_bytes":15074},{"path":"infra/sp500_megarun/catalog_autotune.py","role":"science_code","sha256":"cbf7076ba396f7b5497e6dc36801561b431854d26acdde1b2328185245c5a3fb","size_bytes":8696},{"path":"infra/sp500_megarun/catalog_campaign_definition_builder.py","role":"science_code","sha256":"37ecb6795a79da00419bf8b49d97c8f87e7053cd416b520671795f326265a286","size_bytes":38637},{"path":"infra/sp500_megarun/catalog_campaign_definition_contract.py","role":"science_code","sha256":"7dd513270b245350bf582178d1e40f56cd0763158d5f195f50aa4c735f9d6605","size_bytes":4489},{"path":"infra/sp500_megarun/catalog_campaign_registry.py","role":"science_code","sha256":"3d7102033eec3f1664ae49bd44de03fdd36d7be96a6dc2718527693495f9e97d","size_bytes":8517},{"path":"infra/sp500_megarun/catalog_capacity_qualification.py","role":"science_code","sha256":"e37056f68fc4197bab8782e3baa89d2cb8f49f962b0fd3f8308451ba88bc6f96","size_bytes":1351},{"path":"infra/sp500_megarun/catalog_checkpoint_recovery_archive.py","role":"science_code","sha256":"2b4a2c99ab9b499e33122c29d3cfb84f018dc2d3843d902bf6f1dee654e4cfff","size_bytes":24749},{"path":"infra/sp500_megarun/catalog_checkpoint_recovery_auth.py","role":"science_code","sha256":"e7fe196c49e448fbd4e626ccfc9d04581ccc17976d624da5851cd0b0a17a9042","size_bytes":12034},{"path":"infra/sp500_megarun/catalog_checkpoint_recovery_binding.py","role":"science_code","sha256":"b11660771f4e348b83b82425fa9f52b75c0123826de14c596d749c7c4907282a","size_bytes":4331},{"path":"infra/sp500_megarun/catalog_checkpoint_recovery_owner.py","role":"science_code","sha256":"1b0adad5483c97ebf54c01c86a48dbf9f23361ff1bc921f03ae99a918bd06d28","size_bytes":4822},{"path":"infra/sp500_megarun/catalog_checkpoint_recovery_profile.py","role":"science_code","sha256":"2e8665450221ece92afec35ae8f32b84625eb93d0b26fdb2844ae0a84f23f328","size_bytes":17030},{"path":"infra/sp500_megarun/catalog_checkpoint_recovery_restore.py","role":"science_code","sha256":"69aff0a499dc7e997efab7287fbb70d4c94f155ff403ba8f1541880c3e33b85c","size_bytes":26655},{"path":"infra/sp500_megarun/catalog_checkpoint_recovery_source.py","role":"science_code","sha256":"25de8bf90623a3f9b072ed12ed8a8e1f2840227d187882d7b30371f03d9ab3a2","size_bytes":39860},{"path":"infra/sp500_megarun/catalog_component_inventory.py","role":"science_code","sha256":"29932872ee4b47c87606036f457be0b2bf49349813f8a8ded6da27953b12b0d9","size_bytes":1949},{"path":"infra/sp500_megarun/catalog_component_store.py","role":"science_code","sha256":"6cd0286cba0c74776898758a247fd86042bda7b6ec423d2c84690b3fb5d86f38","size_bytes":8194},{"path":"infra/sp500_megarun/catalog_cost_model.py","role":"science_code","sha256":"3194fd6a0fbc85bd79ce2c745fcdd182d8a639a2ddaa50d67ed88cda4ecbf2e4","size_bytes":3191},{"path":"infra/sp500_megarun/catalog_engine_outcome.py","role":"science_code","sha256":"9b3f19d8b295d3369e06c92891a4c07addbc34ebecabe01a7f5d3cbcddd5c4eb","size_bytes":22884},{"path":"infra/sp500_megarun/catalog_fast_canary_acceptance.py","role":"science_code","sha256":"ceddf6053f0d57a9599010a7ed70861384e4572cbf5953594db1b11f79c0e9b5","size_bytes":14918},{"path":"infra/sp500_megarun/catalog_fast_objective.py","role":"science_code","sha256":"c9a5ec97a057fc6de4ef9b71aadfc989ee5bfa597c14adc114de5984cfe676e7","size_bytes":8936},{"path":"infra/sp500_megarun/catalog_fast_path.py","role":"science_